<?xml version="1.0" encoding="UTF-8"?>
<TimeSeries xmlns="http://www.wldelft.nl/fews/PI" xmlns:xsi="http://www.w3.org/2001/XMLSchema-instance" xsi:schemaLocation="http://www.wldelft.nl/fews/PI http://fews.wldelft.nl/schemas/version1.0/pi-schemas/pi_timeseries.xsd" version="1.2">
    <timeZone>0.0</timeZone>
    <series>
        <header>
            <type>instantaneous</type>
            <locationId>N_0</locationId>
            <parameterId>water_level</parameterId>
            <timeStep unit="hour" multiplier="1"/>
            <startDate date="2012-03-01" time="12:00:00"/>
            <endDate date="2012-03-03" time="12:00:00"/>
            <missVal>-999.0</missVal>
            <stationName>3 -</stationName>
            <units>m AD</units>
        </header>
        <event date="2012-03-01" time="12:00:00" value="6.0" flag="2"/>
        <event date="2012-03-01" time="18:00:00" value="5.5" flag="2"/>
        <event date="2012-03-02" time="00:00:00" value="5.2" flag="2"/>
        <event date="2012-03-02" time="06:00:00" value="5.8" flag="2"/>
        <event date="2012-03-02" time="12:00:00" value="6.5" flag="2"/>
        <event date="2012-03-02" time="18:00:00" value="5.0" flag="2"/>
        <event date="2012-03-03" time="00:00:00" value="5.6" flag="2"/>
        <event date="2012-03-03" time="06:00:00" value="6.0" flag="2"/>
        <event date="2012-03-03" time="12:00:00" value="7.0" flag="2"/>
    </series>
    <series>
        <header>
            <type>instantaneous</type>
            <locationId>Control group of S_10_##1</locationId>
            <parameterId>rtc_timerule</parameterId>
            <timeStep unit="hour" multiplier="1"/>
            <startDate date="2012-03-01" time="12:00:00"/>
            <endDate date="2012-03-03" time="12:00:00"/>
            <missVal>-999.0</missVal>
            <stationName>3 -</stationName>
            <units>m AD</units>
        </header>
        <event date="2012-03-01" time="12:00:00" value="4.3" flag="2"/>
        <event date="2012-03-01" time="18:00:00" value="4.1" flag="2"/>
        <event date="2012-03-02" time="00:00:00" value="4.8" flag="2"/>
        <event date="2012-03-02" time="06:00:00" value="5.1" flag="2"/>
        <event date="2012-03-02" time="12:00:00" value="5.8" flag="2"/>
        <event date="2012-03-02" time="18:00:00" value="4.2" flag="2"/>
        <event date="2012-03-03" time="00:00:00" value="3.2" flag="2"/>
        <event date="2012-03-03" time="06:00:00" value="2.2" flag="2"/>
        <event date="2012-03-03" time="12:00:00" value="2.1" flag="2"/>
    </series>
    <series>
        <header>
            <type>instantaneous</type>
            <locationId>3</locationId>
            <parameterId>water_discharge</parameterId>
            <timeStep unit="hour" multiplier="1"/>
            <startDate date="2012-03-01" time="12:00:00"/>
            <endDate date="2012-03-03" time="12:00:00"/>
            <missVal>-999.0</missVal>
            <stationName>3 -</stationName>
            <units>m3/s</units>
        </header>
        <event date="2012-03-01" time="12:00:00" value="5.0" flag="2"/>
        <event date="2012-03-01" time="18:00:00" value="7.0" flag="2"/>
        <event date="2012-03-02" time="00:00:00" value="6.0" flag="2"/>
        <event date="2012-03-02" time="06:00:00" value="8.0" flag="2"/>
        <event date="2012-03-02" time="12:00:00" value="5.5" flag="2"/>
        <event date="2012-03-02" time="18:00:00" value="7.5" flag="2"/>
        <event date="2012-03-03" time="00:00:00" value="6.5" flag="2"/>
        <event date="2012-03-03" time="06:00:00" value="8.5" flag="2"/>
        <event date="2012-03-03" time="12:00:00" value="5.3" flag="2"/>
    </series>
</TimeSeries>
