<?xml version="1.0" encoding="UTF-8"?>
<TimeSeries xmlns="http://www.wldelft.nl/fews/PI" xmlns:xsi="http://www.w3.org/2001/XMLSchema-instance" xsi:schemaLocation="http://www.wldelft.nl/fews/PI http://fews.wldelft.nl/schemas/version1.0/pi-schemas/pi_timeseries.xsd" version="1.4">
    <timeZone>1.0</timeZone>
    <series>
        <header>
            <type>instantaneous</type>
            <locationId>R_3_14</locationId>
            <parameterId>water_level</parameterId>
            <timeStep unit="hour" multiplier="1"/>
            <startDate date="2012-03-01" time="12:00:00"/>
            <endDate date="2012-03-03" time="12:00:00"/>
            <missVal>NaN</missVal>
            <stationName>R_3_14 -</stationName>
            <units>m AD</units>
        </header>
    </series>
    <series>
        <header>
            <type>instantaneous</type>
            <locationId>R_3_44</locationId>
            <parameterId>water_level</parameterId>
            <timeStep unit="hour" multiplier="1"/>
            <startDate date="2012-03-01" time="12:00:00"/>
            <endDate date="2012-03-03" time="12:00:00"/>
            <missVal>NaN</missVal>
            <stationName>R_3_44 -</stationName>
            <units>m AD</units>
        </header>
    </series>
    <series>
        <header>
            <type>instantaneous</type>
            <locationId>R_3-2850.43</locationId>
            <parameterId>water_discharge</parameterId>
            <timeStep unit="hour" multiplier="1"/>
            <startDate date="2012-03-01" time="12:00:00"/>
            <endDate date="2012-03-03" time="12:00:00"/>
            <missVal>NaN</missVal>
            <stationName>R_3-2850.43 -</stationName>
            <units>m AD</units>
        </header>
    </series>
    <series>
        <header>
            <type>instantaneous</type>
            <locationId>R_3-2850.43</locationId>
            <parameterId>water_discharge</parameterId>
            <qualifierId>average</qualifierId>
            <timeStep unit="hour" multiplier="1"/>
            <startDate date="2012-03-01" time="12:00:00"/>
            <endDate date="2012-03-03" time="12:00:00"/>
            <missVal>NaN</missVal>
            <stationName>R_3-2850.43 -</stationName>
            <units>m AD</units>
        </header>
    </series>
<!--
    <series>
        <header>
            <type>instantaneous</type>
            <locationId>4</locationId>
            <parameterId>water_level</parameterId>
            <timeStep unit="hour" multiplier="1"/>
            <startDate date="2012-03-01" time="12:00:00"/>
            <endDate date="2012-03-03" time="12:00:00"/>
            <missVal>NaN</missVal>
            <stationName>4 -</stationName>
            <units>m AD</units>
        </header>
    </series>
    <series>
        <header>
            <type>instantaneous</type>
            <locationId>3</locationId>
            <parameterId>water_discharge</parameterId>
            <timeStep unit="hour" multiplier="1"/>
            <startDate date="2012-03-01" time="12:00:00"/>
            <endDate date="2012-03-03" time="12:00:00"/>
            <missVal>NaN</missVal>
            <stationName>3 -</stationName>
            <units>m3/s</units>
        </header>
    </series>
-->
</TimeSeries>