<?xml version="1.0" encoding="utf-8" standalone="yes"?>
<TimeSeries xmlns:xsi="http://www.w3.org/2001/XMLSchema-instance" xmlns="http://www.wldelft.nl/fews/PI" xsi:schemaLocation="http://www.wldelft.nl/fews/PI C:\Users\belt_pe\OneDrive%20-%20Stichting%20Deltares\Documents\IntervalRule\rtc\pi_timeseries.xsd" version="1.2">
  <series>
    <header>
      <type>instantaneous</type>
      <locationId>[IntervalRule]Control Group 1/Interval Rule</locationId>
      <parameterId>SP</parameterId>
      <timeStep unit="minute" multiplier="1" divider="1" />
      <startDate date="2021-06-14" time="00:00:00" />
      <endDate date="2021-06-15" time="00:00:00" />
      <missVal>-999.0</missVal>
      <stationName />
      <units />
    </header>
    <event date="2021-06-14" time="00:00:00" value="5" />
    <event date="2021-06-15" time="00:00:00" value="5" />
  </series>
</TimeSeries>